{
  "company": "HD ECOMMERCE",
  "supplier_name": "FOURNITEST SARL",
  "supplier_siret": "12345678900012",
  "supplier_vat_number": "FR12123456789",
  "supplier_address": "1 rue du Test, 63000 Clermont-Ferrand, France",
  "supplier_country": "FR",
  "invoice_number": "FT-2026-001",
  "invoice_date": "2026-07-01",
  "due_date": "2026-07-31",
  "currency": "EUR",
  "amount_excluding_tax": 100.0,
  "vat_amount": 20.0,
  "amount_including_tax": 120.0,
  "vat_breakdown": [
    {
      "rate": 20.0,
      "taxable_amount": 100.0,
      "vat_amount": 20.0
    }
  ],
  "document_type": "invoice",
  "purchase_order_number": null,
  "iban": null,
  "confidence": 0.98,
  "anomalies": [],
  "raw_summary": "Facture FT-2026-001 de FOURNITEST SARL adressée à HD ECOMMERCE, 120,00 EUR TTC (TVA 20 %), échéance au 2026-07-31. Données strictement fictives (exemple de test)."
}
